Name,Description,Campus,Research Categories,Citizenship Req,Preferred Major,School/Dept,Professor,More Info
Integrated Biochemical and Physicochemical Processes to Recover Critical Metals from Municipal Solid Waste in Landfills,"In the United States, landfills containing municipal solid waste (MSW) represent a large repository of critical metals, particularly originating from discarded electronic waste (e-waste). To date, no known technologies have successfully recovered critical metals from landfills, which is uniquely challenged by the inability to directly access deposited materials. Landfill leachates present an opportunity to capture critical metals from the aqueous stream.  This SURF project will support a larger, integrated effort by addressing these specific research objectives: i) characterize the currently unknown critical metal content in existing US landfill leachates, and ii) elucidate the complex chemistry of metals in landfill leachates. No known studies have reported valued metal concentrations beyond those of heavy metals , ,  in US landfill leachates. Additionally, metal speciation is highly dynamic, since the landfill redox, pH, and ligand composition change over time as they mature and MSW undergoes biological, chemical, and physical transformations. The lack of knowledge of chemical speciation of each metal is a critical technical gap that will inhibit separation and recovery efforts. The SURF student will work with graduate student and faculty mentors on the following objectives and tasks: Elemental analysis: landfill leachate samples will be processed (including microwave assisted digestion) and elements will be detected and quantified with Inductively Coupled Plasma ??Optical Emission Spectroscopy (ICP-OES). Water quality parameters: Total organic and inorganic carbon (HCO3- and CO32-) will be measured by a TOC analyzer, and dominant organic ligands (carboxylic acids and phenolic groups), measured via acid-base titration. These water quality parameters strongly influence the speciation of the elements. Modeling chemical speciation:. The typical composition of landfill leachate will include inorganic ligands, such as hydroxide (OH^-), chloride (Cl^-), bicarbonate ??HCO??3^-), carbonate (CO_3^(2-)), ammonia (NH_3), sulfate (SO_4^(2-)) and phosphate (PO_4^(3-)), along with many organic ligands, particularly short chain carboxylic acids. We will model metal speciation with tools such as Visual MINTEQ or MINEQL+ and compare: greatest to least MT among the seven metals, comparisons of chemical speciation (uncomplexed versus complexed), and ranges of conditions (pH, redox, ionic strength). Analytical results from including measurement of various ligand concentrations, the pH, the ionic strength, and the MT, will enable detailed predictions of species and concentrations. The outcomes from this research will help with assessing the technical and economic feasibility of recovering critical elements and precious metals from MSW landfills.",West Lafayette,"Chemical Unit Operations, Ecology and Sustainability, Energy and Environment, Engineering the Built Environment, Environmental Characterization",No citizenship requirements,Environmental and Ecological Engineering Chemical Engineering Civil Engineering Biological Engineering - multiple concentrations Environmental and Natural Resources Engineering Chemistry Natural Resources and Environmental Science (multiple concentrations),Lyles School of Civil Engineering,Inez Hua,https://engineering.purdue.edu/EEE/AboutUs/News/2024/NSFCollaborativeResearchAward
Intelligent Undersea Network Systems,"The focus of this project is on developing algorithms for networked intelligence, surveillance and reconnaissance (ISR) systems that are specifically tailored for the challenges posted by adversarial undersea environments. Students participating in the program will work with a team of graduate students, postdocs, and professors towards achieving these goals. This includes investigating algorithms for (1) path planning and communications/networking among autonomous underwater vehicles (AUVs) and surface stations, and (2) distributed computation to allow the individual agents to parse locally gathered information into situational awareness. The student will gain a concrete understanding important contemporary undersea ISR applications, including monitoring choke points in maritime settings.",West Lafayette,"Big Data/Machine Learning, Internet of Things (IoT), Mobile Computing",No citizenship requirements,No Major Restriction Electrical Engineering Computer Engineering Mathematics Computer Science,Elmore Family School of Electrical and Computer Engineering,Christopher Brinton,https://www.cbrinton.net/
IoT sensor development for trailer monitoring,This project involves working with a partnering Korean company for IoT sensor development for temperature and sound monitoring of a trailer.,West Lafayette,"Fabrication and Robotics, Internet of Things (IoT)",No citizenship requirements,Mechanical Engineering Electrical Engineering,School of Mechanical Engineering,Martin Jun,N/A
Kagome embeddings on quantum hardware in search of new quantum phases of matter,"Kagome and Triangular lattices form the basis of a set of geometrically frustrated spin lattices where all the constraints of the Hamiltonian are not satisfied. This leads to unusual ground and excited states which show unique features such as magnetization plateaus and spin glass states. The problem becomes much more interesting in the quantum realm where quantum fluctuations adds to the frustration to lead to several new and exotic phases which are purely 'quantum', i.e. with no classical analog. These phases not only are of great interest to the condensed matter community as they are realized in real materials, but also in the quantum computing community as they help to benchmark the quantum hardware. In this project, we attempt to understand such interesting phases of matter using quantum computers accessible at Purdue University. We test the results against classical simulations to validate the result for small number of spins, and seek to unearth newer phases when the number of spins are larger. The goal of the project is to come up with predictions for Ising triangular lattices in a transverse field and deduce their phase transitions using quantum annealing and quenching in the pseudospin basis.",West Lafayette,Material Modeling and Simulation,No citizenship requirements,No Major Restriction,Physics and Astronomy,Arnab Banerjee,N/A
Large Language Models (LLMs) Fine-Tuning for Biological Engineering Education,"Objective: Fine-tune LLMs to enhance understanding of complex concepts. Key Tasks: 1.	Compile a comprehensive Biological Engineering Process Design related knowledge base 2.	Fine-tune open-source LLM using a curriculum learning approach 3.	Evaluate model performance on advanced evaluation tasks 4.	Compare with general-purpose LLMs and traditional teaching methods",West Lafayette,"Biological Simulation and Technology, Learning and Evaluation",No citizenship requirements,Agricultural Engineering Biological Engineering - multiple concentrations Food Science Pharmacy Biology,Agricultural and Biological Engineering Department,Dharmendra Saraswat,N/A
Light-assisted fabrication of biomaterials,"Our lab is interested in developing new biomaterials for applications in regenerative medicine. We work with synthetic and natural materials including hyaluronic acid, alginate, and decellularized tissues. To enable their rapid and user-defined fabrication into biomaterials, the materials are chemically modified to enable light-mediated crosslinking. The fabricated biomaterials can be tailored towards various applications. Examples of these include injectable biomaterials for tissue regeneration and in vitro platforms to probe cell behavior. The SURF projects will explore new directions in the light-assisted fabrication of biomaterials with a special emphasis on controlling physical, mechanical, and biochemical properties to guide cell and tissue function. SURF students will be trained on material synthesis, fabrication techniques, characterization methods, quantitative analysis of biomaterial properties, and in the design of experiments to probe specific hypotheses. These activities will involve a range of instruments, methodologies, and approaches including chemical modification, microscopy, cell culture, and animal experiments. We are seeking motivated students who are interested in gaining hands-on skills in biomaterials development and applications in regenerative medicine. Those with prior experience in a wet-lab environment are especially encouraged to apply.",West Lafayette,"Biological Characterization and Imaging, Biological Simulation and Technology, Cellular Biology, Material Processing and Characterization, Medical Science and Technology","No citizenship requirements, U.S. Citizen, U.S. Permanent Resident",Biomedical Engineering Mechanical Engineering Chemical Engineering Biological Engineering - multiple concentrations,Weldon School of Biomedical Engineering,Taimoor Qazi,www.qazi-lab.com
Lilly-Purdue Research Alliance Center project: nanoparticle formulation and process engineering,"The Lilly-Purdue Research Alliance Center (LPRC) serves as an essential hub for collaborative exploration of new technologies that enhance every phase of pharmaceutical research, from discovery to delivery. The LPRC?? mission is to push the boundaries of science through collective learning and active engagement between Purdue and Lilly researchers. Currently, LPRC researchers at Purdue and Lilly are focused on genetic medicine, intrathecal delivery and nanoparticle drug delivery. This project is related to nanoparticle formulation techniques. The student will become familiar with industrially-relevant formulation strategies and evaluate their utilization as one unit operation that is part of larger processes.",West Lafayette,Nanotechnology,No citizenship requirements,No Major Restriction,Agricultural and Biological Engineering,Kurt Ristroph,https://www.ristrophlab.com/
Localized Deep Learning for Decentralized and Dynamic Environments,"Despite being widely used, global end-to-end learning has several key limitations. It requires centralized computation, making it feasible only on a single device or a carefully synchronized cluster. This restricts its use on unreliable or resource-constrained devices, such as commodity hardware clusters or edge computing networks. Localized deep learning has the potential to develop highly decentralized, parallel, asynchronous, and fault-tolerant algorithms that can learn on heterogeneous hardware devices under dynamic conditions while maintaining comparable model performance. The long-term vision would be an ""Internet of AI"" where devices can continuously learn in any conditions. REU participants will be part of a collaborative team focused on developing novel localized deep learning approaches. The goal is to create a learning algorithm with local objectives that learns rich unsupervised representations in a highly decentralized and fault-tolerant way. As one specific context, suppose a sensor network should be trained to detect a complex or global event such as anomalous activity over a large area of the wilderness. Each sensor has a very incomplete picture of the situation and can communicate with nearby sensors but cannot communicate with a global centralized server. The goal is to implement both width-parallel and depth-parallel learning on an unreliable set of sensor devices that have limited compute power. This project will focus on the fundamental aspects of novel local learning mechanisms in this highly decentralized environment.",West Lafayette,"Big Data/Machine Learning, Deep Learning","U.S. Citizen, U.S. Permanent Resident",No Major Restriction,ECE,David Inouye,N/A
Mass spectrometry of biomolecules and nanoclusters,"We are using mass spectrometry to study the localization of lipids, drugs, and proteins in biological tissues and to prepare novel functional interfaces using well-defined polyatomic ions. The student will work with a graduate student mentor to either perform nanocluster synthesis and characterization using mass spectrometry and electrochemical measurements or to develop new analytical approaches for quantitative analysis of biomolecules in biological samples. We are also developing computational approaches for connecting mass spectrometry imaging data with biochemical pathways. In both projects, the student will be trained to operate state-of-the-art mass spectrometers and perform independent data acquisition and analysis. The student will also work with  scientific literature to obtain a broader understanding of the field.",N/A,"Biological Characterization and Imaging, Medical Science and Technology, Nanotechnology",N/A,N/A,Chemistry,Julia Laskin,https://www.chem.purdue.edu/jlaskin/
Measuring Systemic Inflammatory Effects of Synovial Joint Injury,"In this project, we are interested in the aftermath of synovial joint injury and whether it triggers inflammation or similar effects in other tissues of the body. We will conduct this work in an institution-approved animal model and collect tissues. The student role in this project will be to analyze some of the collected tissues and evaluate the data associated with this analysis.",West Lafayette,"Biological Characterization and Imaging, Medical Science and Technology, Other",No citizenship requirements,Biomedical Engineering Mechanical Engineering Biological Engineering - multiple concentrations,Weldon School of Biomedical Engineering,Deva Chan,https://engineering.purdue.edu/ChanLab
Mechano-transduction in progerin-expressing endothelial cells,"A mutant truncated form of lamin called progerin is responsible for premature aging disease Hutchinson-Gilford progeria syndrome (HGPS). Interestingly, progerin is also found in normal adults, and increases with age. Defective nuclear lamina in aged cells share similarities with nuclei of HGPS cells such as distorted nuclear shape and increased mechano-sensitivity. HGPS patients share something else with older people: the progression of cardiovascular diseases such as atherosclerosis. Endothelial cells in the vasculature are constantly exposed to hemodynamic forces of blood flow on the lumen side. The presence of progerin yielded stiff nucleus, but softer chromatin in nuclear interior, which probably contributed to decreased responsiveness to mechanical stress. In this project, we will develop an endothelial cell line that stably express GFP-fused wildtype lamin and progerin proteins. These cells will be used in flow experiments to examine the effect of shear stress on how progerin affect signaling transduction such as the AMPK pathway, and the subsequent effect on cell homeostasis and aging. Students will be involved in a range of techniques, such as cell culture, transfection, fluorescence live cell imaging, immunohistochemistry, quantitative image analysis, Western blotting, PCR.",Indianapolis,"Biological Characterization and Imaging, Cardiovascular Disease Research, Cellular Biology","U.S. Citizen, U.S. Permanent Resident",Biomedical Engineering Chemical Engineering Biology Biological Engineering - multiple concentrations,Weldon School of Biomedical Engineering,Julie Ji,N/A
Microfluidic system for studying the transport of therapeutics,"The development of a microfluidic model for various therapeutics, ranging from various sizes and concentrations, will be explored. Transport within the hydrogels will be analyzed to generate correlations with the various aspects of the therapeutic solutions. Microfluidic models have been recognized as an interesting alternative to animal models for drug screening. These models can mimic some of the physiological characteristics across solid tumors to the physiological barriers. The therapeutic solution will be injected into one of the microchannels, while the other microchannel wells will have the hydrogel formulations in them. The transport of the therapeutic solution in the hydrogel will be measured by fluorescence microscopy or other techniques.",West Lafayette,Other,U.S. Citizen,No Major Restriction,School of Mechanical Engineering,Arezoo Ardekani,https://engineering.purdue.edu/ComplexFlowLab/
Microstructural control of energetic materials,"The goal of this project is to understand how various material properties affect the microstructure, and thus performance, of energetic materials (i.e. propellants, explosives, pyrotechnics). This project requires U.S. citizenship. The researcher will learn material science and manufacturing principles.",West Lafayette,Material Processing and Characterization,U.S. Citizen,Mechanical Engineering Aeronautical and Astronautical Engineering Materials Engineering Chemical Engineering,Mechanical Engineering,Monique McClain,https://mcclain.team/
Modeling elastic cells in fluid flow,"Overview: Microfluidic devices are increasingly used for lab-on-a-chip technology for medical diagnostics. Mammalian cells are elastic and deform under the flow of a microfluidic device. We want to model the deformation of a cell using elasticity theory combined with simple flow. The objective is to model the deformation of a sphere under a shear flow and visualize the resulting shape. Objectives: 1.	Background reading on elasticity theory. 2.	Set up the equations of motion for an elastic cell in a fluid flow. 3.	Solve the equations of motion either analytically with pen and paper, or numerically using MATLAB/python/ or other coding language. 4.	Main Question: Given a sphere in a shear flow, what shape does it deform to?",West Lafayette,"Biological Simulation and Technology, Fluid Modelling and Simulation, Other",No citizenship requirements,No Major Restriction,Mathematics,Kaitlyn Hood,https://www.math.purdue.edu/~kthood/research.html
Multi-modal Capture of Symptoms Data from Speech or Text with Automatic Annotation to Continuous Analysis of Heart Rhythm: Application in the Ehlers-Danlos Syndromes,"The Ehlers-Danlos syndromes (EDS) are a group of hereditary disorders of connective tissue that exhibit joint hypermobility and skin involvement, with other organs involved in varying degrees depending on the type of EDS.  The most common type, known as the hypermobile type, or hEDS, is still without a known genetic cause.  The manifestations of hEDS extend far beyond the musculoskeletal system and skin; aside from chronic pain, the most debilitating symptoms are due to autonomic nervous system (ANS) impairment.  The precise mechanisms leading to autonomic dysfunction in hEDS are not well understood.  Individuals with hEDS have hyper-elastic veins that allow up to 1/3 of the circulating blood volume to collect in the lower extremities upon standing. This can lead to diminished blood flow and oxygen-carrying capacity to the heart, lungs, and brain. A second possible mechanism is compression of the medulla due to craniocervical instability, which occurs when the tendons and ligaments that hold the head on the neck allow excessive movement between the skull and the cervical spine. Thirdly, people with hEDS are often living in constant pain, sending a consistent message to the brain that the body is under threat. This heightens the expression of the sympathetic ??ight-or-flight??nervous system. Since the parasympathetic nervous system mediates central coordination of ??est-and-digest??functions, heart rhythms, gastrointestinal motility, sleep, and quality-of-life are subsequently impaired.  Due to the rarity of this disease, there have been few long-term symptom profiling studies to understand the nature of symptoms with respect to autonomic dysfunction.  In this project, a student will work with clinicians and graduate students to integrate LLM functionality into a digital Continuous Autonomic Physiologist (dCAP) mobile app in a manner that can transcribe spoken language and automatically tag the event to the dCAP data stream.",West Lafayette,"Cardiovascular Disease Research, Mobile Computing",No citizenship requirements,No Major Restriction,Weldon School of Biomedical Engineering,Matthew Ward,N/A
Multiple Target Tracking Using Influence Diagrams,The project will develop an interactive tool using that extends previously a developed influence diagram Kalman filtering tool to perform Multiple Target Tracking. The student will be developing Python code to extend previously developed code that implements influence diagram Kalman filtering and test cases for the Python code using the MATLAB-based Sensor Fusion and Tracking Toolbox.,West Lafayette,Other,No citizenship requirements,Computer Science,Edwardson School of Industrial Engineering,C. Robert Kenley,https://web.ics.purdue.edu/~ckenley/
Operation and characterization of SPT-100 Hall-effect thruster,"Hall thrusters are widely utilized for spacecraft propulsion including applications in LEO (e.g., Starlink) and deep space exploration (e.g., Deep Space Transport).  In Hall thrusters, a neutral gas propellant is ionized and accelerated in ExB-field configuration, achieving high exhaust velocities in the range of 10 - 50 km/s. In this project, the student will work with the Hall-effect thruster SPT-100. The scope of the project includes operating the thruster and neutralizer (a hollow cathode or an inductively coupled plasma) and measuring the thruster's electrical parameters, exhaust plasma jet properties, and thrust level. The student will utilize Langmuir probes (along with other diagnostics) for measurements of plasma parameters and hanging pendulum thrust stand for thrust measurements. In addition, the student is going to prepare and update related documentation for AAE 521 Plasma Lab.",West Lafayette,Other,No citizenship requirements,Aeronautical and Astronautical Engineering,AAE,Alexey Shashurin,https://engineering.purdue.edu/EPPL
Optimization for Robust Machine Learning,"This project aims to develop advanced optimization techniques to enhance the robustness of machine learning models. Robust machine learning is essential for managing noisy, adversarial, and uncertain data, which are common in real-world applications. The research focuses on designing and analyzing novel algorithms to address these challenges by leveraging theoretical tools such as mathematical optimization, stochastic processes, and statistics. The project seeks to improve model robustness and reliability across diverse domains, contributing to a deeper understanding of the interplay between optimization and machine learning, with practical implementations for solving modern data-driven problems.",West Lafayette,Big Data/Machine Learning,No citizenship requirements,No Major Restriction,School of Industrial Engineering,Miaolan Xie,https://miaolan.github.io/
Optimizing components with multi-material solutions,"Traditional components are made of a monolithic material or repeating building block that are identified and fixed at an early stage in the design process.  There are potential advantages to simultaneously designing the component and materials solution.  The objective of this work is to create specific tools to help support and define compositional gradients, diffusion, and geometry.  These tools will be part of a larger project to develop an integrated set of techniques and processes to produce optimized parts that are based on composition and functional gradients designed within the parts. The anticipated outcome of this research is a framework to integrate the design, analysis, manufacture, inspection, and testing of components, that results in the ability to optimize a materials-centric solution for enhancements in part design and new manufacturing processes to produce these components. The results of this project are expected to make significant advancements to improve component performance, reliability, and sustainability.",West Lafayette,"Big Data/Machine Learning, Composite Materials and Alloys, Material Modeling and Simulation, Material Processing and Characterization",U.S. Citizen,Aeronautical and Astronautical Engineering Materials Engineering Mechanical Engineering,School of Aeronautics and Astronautics,Michael Sangid,https://engineering.purdue.edu/ACME2
